sentence,source,title,sentence_length,Kincaid,ARI,Coleman-Liau,FleschReadingEase,GunningFogIndex,LIX,SMOGIndex,RIX,DaleChallIndex,tobeverb,auxverb,conjunction,pronoun,preposition,nominalization,interrogative,article,subordination
"Stotteren is een spraakstoornis die voorkomt bij 0,7-1% van de wereldbevolking en kan leiden tot  angst om te spreken, beperkingen in communicatie, sociale participatie en werkprestaties (American  Psychiatric",ChatGPT,VirtualRealityStotterTherapie.pdf,33,18.506206896551728,21.492413793103445,18.66080444827586,14.034482758620701,19.875862068965517,70.37931034482759,16.41640786499874,12.0,18.686968965517238,1,1,0,0,0,1,0,0,0
"Association, 2013)",ChatGPT,VirtualRealityStotterTherapie.pdf,4,8.790000000000003,14.895000000000003,13.504438500000003,35.60500000000002,0.8,52.0,3.0,1.0,19.5257,0,0,0,0,0,0,0,0,0
"Stottertherapie heeft verschillende doelen, waaronder het opmerken  en aanpassen van fysiek gedrag, ontwikkelen van neutrale of positieve gedachten en meer  geëngageerd zijn in gesprekken (Rodgers & Gerlach, 2020).",ChatGPT,VirtualRealityStotterTherapie.pdf,36,18.97703703703704,23.121111111111112,21.866832962962967,7.096666666666668,24.133333333333333,75.14814814814815,19.431676725154983,13.0,19.59607037037037,1,1,0,0,0,1,0,0,0
"Therapeutische methoden, werkmodellen en behandeltechnieken worden gebruikt om deze doelen  te bereiken, met aanpassingen voor elke patiënt (NVLF, 2020).",ChatGPT,VirtualRealityStotterTherapie.pdf,26,15.420000000000002,19.800526315789476,22.25359852631579,18.350000000000023,18.126315789473683,61.10526315789474,15.24744871391589,8.0,19.53784736842105,0,1,0,0,0,0,0,0,0
"Tijdens de transferfase leert de  therapeut de patiënt aangeleerde vaardigheden automatisch toe te passen in het dagelijks leven  (NVLF, 2020).",ChatGPT,VirtualRealityStotterTherapie.pdf,26,11.090000000000003,16.359,17.410952900000005,51.175000000000026,20.0,60.0,16.41640786499874,8.0,18.8395,0,0,0,0,1,0,0,0,0
"De exposure-based treatment is een gemeenschappelijke methode om situaties te  bepalen waarin vaardigheden kunnen worden toegepast en een hiërarchie vast te stellen (Benito &  Walther, 2015).",ChatGPT,VirtualRealityStotterTherapie.pdf,32,17.76,21.025600000000004,20.411557160000008,12.260000000000023,21.200000000000003,69.0,17.491376746189438,11.0,20.0349,1,2,0,0,0,0,0,1,0
"Virtual reality wordt gebruikt om een tussenstap te vormen om de transferfase verder te  ondersteunen, waarbij realistische omstandigheden in een veilige omgeving worden nagebootst  (Benito & Walther, 2015).",ChatGPT,VirtualRealityStotterTherapie.pdf,35,17.665925925925922,22.074444444444445,20.56019940740741,16.4966666666667,22.651851851851852,75.14814814814815,18.491933384829668,13.0,20.180885185185183,0,2,0,0,0,1,0,0,0
Dit kan patiënten helpen bij het toepassen van aangeleerde vaardigheden  buiten de therapieruimte.,ChatGPT,VirtualRealityStotterTherapie.pdf,15,13.080000000000002,15.503846153846155,19.916134769230766,24.44000000000002,20.58461538461539,51.46153846153846,15.24744871391589,5.0,20.0713,0,1,0,0,0,0,0,0,0
"Het wordt ook gebruikt bij de behandeling van andere stoornissen zoals  angststoornissen, fobieën, paniekaanvallen en posttraumatische stressstoornis (Benito & Walther,  2015).  ",ChatGPT,VirtualRealityStotterTherapie.pdf,30,16.4,23.188499999999998,25.93673685000001,13.105000000000032,20.0,65.0,16.41640786499874,9.0,20.4185,0,1,0,1,0,1,0,1,0
In dit onderzoek werd de effectiviteit van een virtuele realiteit (VR) toepassing getest bij  stottertherapie.,ChatGPT,VirtualRealityStotterTherapie.pdf,19,12.286666666666669,14.958000000000006,18.289796800000005,33.690000000000026,19.333333333333332,55.0,15.24744871391589,6.0,19.117833333333333,0,1,0,0,1,1,0,0,0
In de eerste testfase kozen de testpersonen zelf hun scenario uit drie mogelijke  situaties.,ChatGPT,VirtualRealityStotterTherapie.pdf,16,9.255714285714287,11.475000000000001,14.424999357142863,53.63928571428574,17.02857142857143,49.714285714285715,13.954451150103322,5.0,18.99304285714286,0,0,0,0,1,0,0,0,0
"Het eerste scenario werd vier keer gekozen, het tweede vijf keer en het derde vier keer.",ChatGPT,VirtualRealityStotterTherapie.pdf,18,6.137499999999999,7.470625000000002,8.4418298125,79.55750000000002,11.4,28.5,10.745966692414834,2.0,20.220100000000002,0,1,0,1,0,0,0,1,0
"De  stottertherapeut observeerde de testpersonen tijdens de VR-ervaring en noteerde hun reacties,  terwijl een tweede onderzoeker hen vroeg naar hun ervaring en suggesties voor verbetering.",ChatGPT,VirtualRealityStotterTherapie.pdf,29,16.344,21.402400000000007,20.88194524,22.412000000000038,21.200000000000003,73.0,17.491376746189438,12.0,20.0349,0,0,0,0,0,1,0,1,0
Op basis  van deze feedback werd het prototype geoptimaliseerd.,ChatGPT,VirtualRealityStotterTherapie.pdf,11,8.89777777777778,10.806666666666665,15.537509666666669,47.30000000000003,12.488888888888889,42.333333333333336,10.745966692414834,3.0,19.8729,0,1,0,0,1,0,0,0,0
Het meest gekozen scenario werd behouden en er werd extra aandacht besteed aan factoren die  spreekdruk verhogen om de simulatie realistischer te maken.,ChatGPT,VirtualRealityStotterTherapie.pdf,25,15.440869565217394,16.28217391304348,15.635441565217395,25.32478260869567,21.373913043478264,66.47826086956522,17.491376746189438,10.0,19.19425652173913,0,2,0,1,0,1,0,1,0
Het prototype werd opnieuw getest en  er werd een vervolgscenario toegevoegd.,ChatGPT,VirtualRealityStotterTherapie.pdf,13,13.372727272727271,11.901818181818179,16.254017363636365,18.779090909090932,18.94545454545455,47.36363636363637,13.954451150103322,4.0,19.972099999999998,0,2,0,1,0,0,0,1,0
Een 360°-camera werd gebruikt om de ervaring te  verbeteren.,ChatGPT,VirtualRealityStotterTherapie.pdf,13,6.010000000000002,6.178000000000001,9.463752799999998,69.78500000000003,16.0,40.0,12.486832980505138,3.0,19.9225,0,1,0,0,0,1,0,1,0
Uit de resultaten bleek dat de meeste testpersonen dezelfde spanning voelden als in een  echte situatie en dat de opbouw van het scenario een meerwaarde was.,ChatGPT,VirtualRealityStotterTherapie.pdf,28,12.250000000000004,15.119999999999997,12.460478692307692,53.545000000000016,16.553846153846155,56.769230769230774,13.954451150103322,8.0,19.501484615384616,1,0,0,0,1,1,0,0,0
Het gebrek aan interactie bij  het eerste prototype werd opgelost door de toevoeging van een vervolgscenario.,ChatGPT,VirtualRealityStotterTherapie.pdf,18,12.775000000000002,13.652499999999996,16.159134250000005,31.97000000000001,18.900000000000002,47.25,15.24744871391589,5.0,19.233225,0,1,0,1,0,1,0,1,0
De meerderheid  van de testpersonen ervoer het tweede prototype als meer realistisch.  ,ChatGPT,VirtualRealityStotterTherapie.pdf,15,8.756666666666668,12.829999999999998,17.01269533333334,53.65500000000001,18.133333333333333,45.333333333333336,13.954451150103322,4.0,20.021700000000003,0,0,0,0,0,1,0,1,0
Testpersonen voelden zich meer in de ruimte met het tweede prototype en hoefden minder hun  inlevingsvermogen te gebruiken.,ChatGPT,VirtualRealityStotterTherapie.pdf,20,11.752222222222223,14.783333333333331,16.527930666666663,42.86500000000002,13.866666666666667,51.333333333333336,12.486832980505138,6.0,18.564855555555553,0,0,0,0,0,0,0,0,0
Voor stottertherapeuten was het handig dat ze het beeld van de VR- bril naar de computer konden casten om de testpersoon te volgen.,ChatGPT,VirtualRealityStotterTherapie.pdf,24,8.771304347826089,11.981739130434782,10.266881956521743,73.1421739130435,14.417391304347825,36.04347826086956,12.486832980505138,3.0,19.88077826086957,1,1,0,0,1,0,0,0,0
Testpersonen gaven aan dat VR  een bruikbaar middel is om toe te passen in de transferfase van stottertherapie.,ChatGPT,VirtualRealityStotterTherapie.pdf,20,9.785555555555558,11.64333333333333,12.608030000000007,56.96500000000002,11.644444444444446,40.22222222222222,10.745966692414834,4.0,17.687633333333334,1,0,0,0,0,0,0,0,0
"Verschillende factoren bleken invloed te hebben op de spanning die tijdens de VR-ervaring werd  ervaren, waaronder de uitwerking van het scenario, de interactie en de personen waarmee in  interactie werd gegaan.",ChatGPT,VirtualRealityStotterTherapie.pdf,36,17.435483870967747,20.810645161290324,16.62714748387097,25.273225806451627,22.72258064516129,76.16129032258064,18.491933384829668,14.0,19.945390322580643,0,3,0,0,0,1,0,0,0
Deelnemers vonden VR nuttig om grenzen te verleggen en moeilijke situaties  meerdere keren te oefenen.,ChatGPT,VirtualRealityStotterTherapie.pdf,17,11.500000000000004,13.074000000000005,15.937856399999998,39.33000000000001,16.666666666666668,61.666666666666664,13.954451150103322,7.0,20.170500000000004,0,0,0,0,0,0,0,0,0
Uiteindelijk kan VR niet meer zinvol zijn na het toepassen van  aangeleerde vaardigheden in het dagelijkse leven.,ChatGPT,VirtualRealityStotterTherapie.pdf,19,11.863529411764706,13.390588235294118,15.316758647058826,40.2858823529412,16.211764705882356,46.41176470588235,13.954451150103322,5.0,19.340876470588235,1,1,0,0,0,0,0,0,0
"Deelnemers stelden dat er verschillende scenario's  moesten worden ontwikkeld om te gebruiken en adviseerden dat de hele ruimte in beschouwing  moest worden genomen, inclusief achtergrondgeluiden en algemene sfeer.",ChatGPT,VirtualRealityStotterTherapie.pdf,32,18.913103448275866,22.62931034482758,20.080078827586206,11.117241379310375,25.393103448275866,73.82758620689656,20.320508075688775,13.0,20.32041724137931,0,4,0,0,0,1,0,0,0
VIRTUAL REALITY IN STOTTERTHERAPIE,Original,VirtualRealityStotterTherapie.pdf,4,-14.03,17.072499999999998,22.371221250000005,202.775,1.6,79.0,3.0,3.0,15.6774,0,0,0,0,0,0,0,0,0
BIJ  (JONG),Original,VirtualRealityStotterTherapie.pdf,5,-14.81,-3.9450000000000003,-10.014965499999999,204.805,0.8,2.0,3.0,0.0,19.5257,0,0,0,0,1,0,0,0,0
"VOLWASSENEN  Jana Van Dammea, Hermien De Baeneb, Louise Rasschaertb, Caroline Moerenhoutc en Kirsten  ",Original,VirtualRealityStotterTherapie.pdf,18,9.44923076923077,15.503846153846155,19.916134769230766,50.47076923076926,5.2,59.15384615384615,3.0,6.0,20.0713,0,0,0,0,0,0,0,0,0
"Masselisd   a Lector logopedie en audiologie HOGENT, Onderzoeker 360°",Original,VirtualRealityStotterTherapie.pdf,12,12.831111111111113,12.899999999999999,18.150776777777786,19.100000000000016,12.488888888888889,53.44444444444444,10.745966692414834,4.0,18.118455555555556,0,0,0,0,0,0,0,0,0
"Zorg en Welzijn, stottertherapeut Huis  voor",Original,VirtualRealityStotterTherapie.pdf,8,8.383333333333333,10.615000000000002,15.527063833333337,45.64500000000001,9.066666666666666,39.333333333333336,8.477225575051662,2.0,19.7241,0,0,0,0,0,0,0,0,0
Stotteren   b Student,Original,VirtualRealityStotterTherapie.pdf,4,5.246666666666666,6.760000000000002,7.655925000000003,62.790000000000006,1.2000000000000002,69.66666666666667,3.0,2.0,19.5753,0,0,0,0,0,0,0,0,0
opleiding logopedie en audiologie,Original,VirtualRealityStotterTherapie.pdf,4,24.320000000000004,15.895000000000003,20.901258500000004,-72.17499999999998,31.6,79.0,12.486832980505138,3.0,19.6249,0,0,0,0,0,1,0,0,0
"c Stottertherapeut, Algemene Aanpak Stotteren en VZW BeSt   d Logopedist en stottertherapeut privépraktijk  ",Original,VirtualRealityStotterTherapie.pdf,16,14.895384615384618,18.04,23.082208384615384,11.424615384615402,11.353846153846156,59.15384615384615,10.745966692414834,6.0,18.856684615384616,0,0,0,0,0,0,0,0,0
Binnen stottertherapie is transfer van de aangeleerde vaardigheden naar het dagelijkse  leven niet evident.,Original,VirtualRealityStotterTherapie.pdf,16,14.312857142857148,16.521428571428565,20.72483971428572,17.382142857142874,19.885714285714286,56.857142857142854,15.24744871391589,6.0,18.99304285714286,1,0,0,0,1,0,0,0,0
Virtual Reality (VR) biedt de mogelijkheid om het dagelijkse leven binnen te  brengen in de veiligheid van de therapieruimte.,Original,VirtualRealityStotterTherapie.pdf,23,10.451578947368422,13.603157894736846,14.516952473684213,53.97105263157897,16.02105263157895,55.8421052631579,13.954451150103322,7.0,19.53784736842105,0,0,0,0,0,1,0,0,0
Zo kan de gevreesde situatie meermaals geoefend  worden voordat de stap naar het dagelijkse leven wordt gezet.,Original,VirtualRealityStotterTherapie.pdf,19,9.781176470588235,12.559411764705885,14.279137882352945,55.21529411764709,13.858823529411765,52.294117647058826,12.486832980505138,6.0,20.2697,0,3,0,0,0,1,0,0,0
Het doel van dit onderzoek was de  bereidheid na te gaan van (jong),Original,VirtualRealityStotterTherapie.pdf,16,3.0953846153846136,3.91,5.442655384615385,96.02461538461542,11.353846153846156,28.384615384615387,10.745966692414834,2.0,18.856684615384616,1,0,0,1,0,1,0,1,0
volwassenen die stotteren om VR in te zetten tijdens de  transferfase.,Original,VirtualRealityStotterTherapie.pdf,13,6.936363636363637,8.904545454545453,12.512294000000004,64.9245454545455,15.309090909090907,47.36363636363637,12.486832980505138,4.0,17.10119090909091,0,0,0,0,0,0,0,0,0
Een eerste prototype van VR werd getest door een groep van 13 (jong)volwassenen  die stotteren.,Original,VirtualRealityStotterTherapie.pdf,20,6.8750000000000036,9.236875000000001,10.6467739375,74.27000000000002,13.9,34.75,12.486832980505138,3.0,18.24635,0,1,0,0,0,0,0,1,0
Op basis van hun ervaringen en feedback werd dit geoptimaliseerd met een meer  uitgewerkt scenario en een meer hoogtechnologische vormgeving.,Original,VirtualRealityStotterTherapie.pdf,22,15.220000000000002,16.83,17.998938000000003,21.565000000000012,20.0,55.0,16.41640786499874,7.0,19.628999999999998,0,1,0,0,1,1,0,0,0
Dit tweede prototype werd getest  door 2 (jong)volwassenen die stotteren.  ,Original,VirtualRealityStotterTherapie.pdf,16,8.009090909090911,9.760909090909088,13.581357818181822,57.23363636363637,15.309090909090907,38.27272727272727,12.486832980505138,3.0,17.10119090909091,0,1,0,0,0,0,0,0,0
Resultaten: (Jong)volwassenen die stotteren geven aan potentieel te zien in het inzetten van VR  tijdens de transferfase.,Original,VirtualRealityStotterTherapie.pdf,23,13.063333333333333,13.736666666666665,15.22129711111111,33.46500000000002,18.311111111111114,56.888888888888886,15.24744871391589,7.0,18.564855555555553,0,0,0,0,0,0,0,0,0
Het eerste prototype had een grotere impact dan verwacht.,Original,VirtualRealityStotterTherapie.pdf,10,6.2755555555555596,8.189999999999998,12.270925777777776,66.10000000000001,8.044444444444444,42.333333333333336,8.477225575051662,3.0,18.118455555555556,0,1,0,1,0,0,0,1,0
Een meer  hoogtechnologische uitwerking met 360° beelden werd als meer realistisch ervaren.,Original,VirtualRealityStotterTherapie.pdf,15,10.723333333333333,14.792499999999997,19.462633250000003,39.555000000000014,18.133333333333333,53.666666666666664,13.954451150103322,5.0,18.705866666666665,0,1,0,0,0,1,0,1,0
Discussie en conclusie:,Original,VirtualRealityStotterTherapie.pdf,4,13.113333333333333,11.470000000000006,13.535776000000006,6.390000000000002,14.533333333333331,69.66666666666667,8.477225575051662,2.0,19.5753,0,0,0,0,0,0,0,0,0
volwassenen die stotteren zijn bereid VR te gebruiken om realistische  situaties in te oefenen in de praktijksetting wanneer de transferfase nog niet voltooid is.,Original,VirtualRealityStotterTherapie.pdf,26,13.928333333333335,17.456249999999997,16.530542125000004,37.95000000000003,24.6,65.66666666666666,19.431676725154983,10.0,17.985233333333333,2,0,0,0,0,1,0,0,0
Ze willen  hiermee ook thuis zelfstandig aan de slag gaan.,Original,VirtualRealityStotterTherapie.pdf,12,2.4700000000000024,5.707000000000001,8.8757677,95.16500000000002,8.0,30.0,8.477225575051662,2.0,19.9225,0,1,0,1,0,0,0,0,0
"Virtual Reality, stottertherapie, transferfase, simulatie",Original,VirtualRealityStotterTherapie.pdf,8,26.480000000000008,28.17,37.08025,-85.87999999999998,26.0,105.0,12.486832980505138,5.0,19.674500000000002,0,0,0,0,0,1,0,0,0
Binnen stottertherapie is transfer van de aangeleerde vaardigheden naar het dagelijkse leven niet evident.,Resoomer,VirtualRealityStotterTherapie.pdf,15,14.312857142857148,16.521428571428565,20.72483971428572,17.382142857142874,19.885714285714286,56.857142857142854,15.24744871391589,6.0,18.99304285714286,1,0,0,0,1,0,0,0,0
Virtual Reality biedt de mogelijkheid om het dagelijkse leven binnen te brengen in de veiligheid van de therapieruimte.,Resoomer,VirtualRealityStotterTherapie.pdf,19,11.096666666666668,13.998333333333328,15.547955500000004,47.56500000000001,16.08888888888889,56.888888888888886,13.954451150103322,7.0,19.442077777777776,0,0,0,0,0,1,0,0,0
Transfer binnen stottertherapie voor volwassenen,Resoomer,VirtualRealityStotterTherapie.pdf,5,19.400000000000002,22.518,30.02442880000001,-35.11999999999996,18.0,65.0,10.745966692414834,3.0,19.674500000000002,0,0,0,0,0,0,0,0,0
"Stotteren is een stoornis in de vloeiendheid van het spreken en komt naar schatting bij 0,7-1% van de wereldbevolking voor .",Resoomer,VirtualRealityStotterTherapie.pdf,21,8.333333333333332,11.722857142857144,11.069561285714286,72.72000000000003,12.20952380952381,49.57142857142857,10.745966692414834,6.0,18.964290476190477,1,0,0,0,0,1,0,0,0
‘fluency shaping therapy’.,Resoomer,VirtualRealityStotterTherapie.pdf,6,13.113333333333333,13.04,15.495726333333337,6.390000000000002,14.533333333333331,103.0,8.477225575051662,3.0,19.5753,0,0,0,0,0,1,0,0,0
Bij elk van deze therapievormen kunnen de aanpak en de aangeleerde vaardigheden enigszins verschillen .,Resoomer,VirtualRealityStotterTherapie.pdf,15,12.62714285714286,15.175714285714285,19.044882285714294,29.467857142857163,19.885714285714286,49.714285714285715,15.24744871391589,5.0,20.1209,0,1,0,0,1,0,0,0,0
"Een overeenkomst tussen deze therapievormen is evenwel dat de aangeleerde vaardigheden op een bepaald moment zullen worden toegepast in het dagelijks leven, ook wel de ‘transferfase’ genoemd.",Resoomer,VirtualRealityStotterTherapie.pdf,31,17.665925925925922,20.15555555555556,18.16470455555556,16.4966666666667,22.651851851851852,64.03703703703704,18.491933384829668,10.0,19.011255555555557,1,2,0,0,0,0,0,1,0
Tijdens deze fase zal de therapeut de persoon die stottert zo goed mogelijk begeleiden in het automatiseren en generaliseren van de aangeleerde vaardigheden buiten de therapieruimte .,Resoomer,VirtualRealityStotterTherapie.pdf,27,17.69615384615385,19.83,18.340329692307698,14.498846153846177,22.707692307692312,68.3076923076923,18.491933384829668,11.0,19.501484615384616,0,1,0,0,1,0,0,0,0
De vraag tot het binnenbrengen van de realiteit in de therapieruimte wordt niet alleen binnen stottertherapie gesteld.,Resoomer,VirtualRealityStotterTherapie.pdf,18,11.169411764705881,15.05294117647059,17.39200017647059,45.26235294117649,16.211764705882356,46.41176470588235,13.954451150103322,5.0,19.340876470588235,0,1,0,0,0,0,0,1,0
"Ook bij het behandelen van onder andere angststoornissen zoals fobieën, paniekaanvallen en posttraumatische stressstoornis probeert men desensitisatie te bereiken door het binnenbrengen van de realiteit in de praktijkruimte.",Resoomer,VirtualRealityStotterTherapie.pdf,30,19.772857142857145,25.371785714285714,24.09146975,3.1721428571428767,25.485714285714288,70.85714285714286,20.320508075688775,12.0,19.123514285714286,0,0,0,0,0,1,0,0,0
"Deze stoornissen tonen vergelijkbare affectieve, gedrags- en cognitieve componenten met die van stotteren .",Resoomer,VirtualRealityStotterTherapie.pdf,15,15.803076923076926,18.04,23.082208384615384,4.9169230769230925,23.661538461538463,66.84615384615384,16.41640786499874,7.0,17.64206923076923,0,0,0,0,0,0,0,0,0
Bij dit type stoornissen werden reeds positieve resultaten gezien door gebruik te maken van virtuele realiteit of kortweg VR.,Resoomer,VirtualRealityStotterTherapie.pdf,19,11.693684210526317,14.346842105263157,15.445350000000005,45.06578947368425,16.02105263157895,55.8421052631579,13.954451150103322,7.0,18.706794736842106,0,1,0,0,1,0,0,0,0
De scenario’s werden gefilmd met een smartphonecamera en afgespeeld met een VRbril die de onderzoekers reeds ter beschikking hadden .,Resoomer,VirtualRealityStotterTherapie.pdf,21,12.860000000000003,14.945999999999998,15.646997600000002,38.48500000000003,18.0,50.0,15.24744871391589,6.0,18.050000000000004,0,2,0,0,0,1,0,1,0
Dit prototype werd getest in de logopedische praktijk van één van de onderzoekers.,Resoomer,VirtualRealityStotterTherapie.pdf,14,8.541538461538462,10.069230769230767,13.131691307692307,56.978461538461566,14.430769230769233,43.769230769230774,12.486832980505138,4.0,18.856684615384616,0,1,0,0,0,0,0,0,0
De volwassen zorgvragers kregen de mogelijkheid om dit prototype vrijwillig te testen.,Resoomer,VirtualRealityStotterTherapie.pdf,13,10.723333333333333,13.615000000000002,17.992670500000003,39.555000000000014,21.46666666666667,53.666666666666664,15.24744871391589,5.0,20.021700000000003,0,0,0,0,0,1,0,1,0
In het totaal gingen 13 personen in op dit aanbod.,Resoomer,VirtualRealityStotterTherapie.pdf,11,4.830000000000002,2.41,4.759872000000001,78.24500000000003,12.0,20.0,10.745966692414834,1.0,16.7645,0,0,0,0,1,0,0,0,0
De leeftijd van de testpersonen varieerde tussen 16 en 50 jaar.,Resoomer,VirtualRealityStotterTherapie.pdf,12,3.7181818181818187,6.335454545454546,9.305102545454549,87.99727272727276,11.672727272727274,38.27272727272727,10.745966692414834,3.0,19.972099999999998,0,0,0,0,0,0,0,1,0
Ze waren allemaal de startfase van stottertherapie voorbij .,Resoomer,VirtualRealityStotterTherapie.pdf,9,11.130000000000003,12.596250000000005,17.984836125,29.515000000000022,13.200000000000001,58.0,10.745966692414834,4.0,19.823300000000003,1,0,0,1,0,0,0,0,0
De testpersonen kozen zelf welk scenario voor hen het meest geschikt leek.,Resoomer,VirtualRealityStotterTherapie.pdf,13,7.773333333333333,8.905000000000001,12.112819500000004,60.70500000000002,11.466666666666667,37.0,10.745966692414834,3.0,18.705866666666665,0,0,0,0,0,0,0,1,0
"Scenario 1 werd vier keer gekozen, scenario 2 vijf keer en scenario",Resoomer,VirtualRealityStotterTherapie.pdf,13,9.740000000000002,6.157499999999999,8.682906416666672,46.605000000000025,14.8,45.333333333333336,12.486832980505138,4.0,20.021700000000003,0,1,0,0,0,0,0,0,0
3 vier keer.,Resoomer,VirtualRealityStotterTherapie.pdf,4,-6.553333333333333,-5.800000000000001,-8.023677666666662,147.39000000000001,1.2000000000000002,3.0,3.0,0.0,19.5753,0,0,0,0,0,0,0,0,0
RESULTATEN Vooraf en/of tijdens de interactie werd door het merendeel van de testpersonen eenzelfde type spanning ervaren als deze die in een echte situatie ervaren wordt.,Resoomer,VirtualRealityStotterTherapie.pdf,27,13.732592592592596,17.189999999999998,14.462576148148152,44.69666666666669,19.68888888888889,64.03703703703704,16.41640786499874,10.0,18.426440740740745,0,2,0,0,0,1,0,0,0
Dit was voor de meesten onder hen onverwacht.,Resoomer,VirtualRealityStotterTherapie.pdf,9,3.7550000000000026,4.353750000000002,7.695096875000004,82.39000000000001,8.200000000000001,33.0,8.477225575051662,2.0,15.875800000000002,1,0,0,0,0,0,0,0,0
"De opbouw van het scenario vóór de effectieve interactie, bijvoorbeeld het wachten in de rij bij de bakker, werd aangehaald als meerwaarde.",Resoomer,VirtualRealityStotterTherapie.pdf,25,11.22636363636364,14.19045454545455,13.58990440909091,53.75954545454549,17.89090909090909,53.81818181818181,15.24744871391589,7.0,19.79997272727273,0,1,0,0,0,1,0,1,0
"""Terwijl je jouw beurt afwacht, voel je de stress opkomen.",Resoomer,VirtualRealityStotterTherapie.pdf,13,1.2900000000000027,5.235999999999997,8.287782600000003,103.625,8.0,40.0,8.477225575051662,3.0,19.9225,0,0,0,0,0,0,0,0,0
De stottertherapeut die het experiment bijwoonde gaf aan dat bij de meeste deelnemers een goede inleving observeerbaar was.,Resoomer,VirtualRealityStotterTherapie.pdf,19,11.752222222222223,15.044999999999995,16.854589055555557,42.86500000000002,18.311111111111114,51.333333333333336,15.24744871391589,6.0,18.564855555555553,1,0,0,0,0,1,0,1,0
Powered by TCPDF (www.tcpdf.org),Resoomer,VirtualRealityStotterTherapie.pdf,6,-3.416666666666666,1.1950000000000003,3.767361833333336,130.245,2.4000000000000004,22.666666666666668,3.0,1.0,17.092433333333332,0,0,0,0,0,0,0,0,0
Stottertherapie heeft tot doel de communicatie en sociale participatie te verbeteren door middel  van verschillende methoden en technieken.  ,SciSpace,VirtualRealityStotterTherapie.pdf,21,16.996666666666666,18.970000000000006,21.75446488888889,5.265000000000025,20.53333333333333,62.44444444444444,16.41640786499874,8.0,19.442077777777776,0,1,0,0,0,1,0,0,0
"De overdrachtsfase omvat het toepassen van aangeleerde vaardigheden in praktijksituaties, wat  een uitdaging kan zijn.  3.",SciSpace,VirtualRealityStotterTherapie.pdf,21,13.5125,16.596250000000005,19.834041125000006,26.682500000000015,21.400000000000002,53.5,16.41640786499874,6.0,19.233225,1,1,0,0,0,1,0,1,0
Virtual reality (VR) is in andere therapieën gebruikt om patiënten ongevoelig te maken voor  gevreesde situaties en kan een nuttig hulpmiddel zijn bij stottertherapie.  ,SciSpace,VirtualRealityStotterTherapie.pdf,29,15.895,18.044999999999995,17.2655235,23.85000000000001,21.26666666666667,65.66666666666666,17.491376746189438,10.0,19.301066666666667,2,1,0,0,0,0,0,0,0
"Een studie testte VR-scenario's met stotterpatiënten en ontdekte dat VR potentieel heeft als  hulpmiddel voor overdracht bij stottertherapie, maar verder onderzoek is nodig om de effectiviteit en  haalbaarheid ervan te bepalen (Vaezipour et al., 2021).  1.",SciSpace,VirtualRealityStotterTherapie.pdf,45,20.20756756756757,23.802432432432433,16.771667081081084,16.08540540540543,24.52972972972973,69.43243243243244,19.431676725154983,12.0,20.408186486486485,1,1,0,0,0,1,0,1,0
"De testdeelnemers kozen het meest geschikte scenario voor hen, waarbij scenario 2 het meest  werd gekozen.  2.",SciSpace,VirtualRealityStotterTherapie.pdf,22,10.47529411764706,11.728235294117646,13.24151711764706,50.2388235294118,16.211764705882356,52.294117647058826,13.954451150103322,6.0,19.340876470588235,0,1,0,0,0,0,0,1,0
