sentence,source,title,sentence_length,Kincaid,ARI,Coleman-Liau,FleschReadingEase,GunningFogIndex,LIX,SMOGIndex,RIX,DaleChallIndex,tobeverb,auxverb,conjunction,pronoun,preposition,nominalization,interrogative,article,subordination
"Het prototype is geoptimaliseerd op basis van feedback, waaronder het toevoegen van factoren die  de spreekdruk verhogen.  ",SciSpace,VirtualRealityStotterTherapie.pdf,21,13.945882352941176,15.329999999999998,17.73787376470589,25.356470588235307,20.917647058823533,64.05882352941177,16.41640786499874,8.0,18.41205294117647,1,0,0,1,0,0,0,1,0
"De VR-ervaring bleek realistisch, maar er werden verbeteringen voorgesteld voor meer realistische  interacties en instellingen.  ",SciSpace,VirtualRealityStotterTherapie.pdf,19,16.220000000000006,20.61,25.34561800000001,5.4900000000000055,22.0,61.666666666666664,16.41640786499874,7.0,20.170500000000004,0,1,0,0,0,1,0,1,0
Deelnemers zagen VR als een nuttig hulpmiddel om te oefenen en zich voor te bereiden op  situaties uit het echte leven in de stottertherapie.,SciSpace,VirtualRealityStotterTherapie.pdf,26,11.96166666666667,13.335,11.385672500000002,52.05,17.933333333333334,49.0,15.24744871391589,6.0,19.958983333333336,0,0,0,0,0,0,0,0,0
(Bron: onderzoeksdocument)  1.,SciSpace,VirtualRealityStotterTherapie.pdf,8,13.113333333333333,16.18,19.415627000000008,6.390000000000002,14.533333333333331,36.333333333333336,8.477225575051662,1.0,19.5753,0,0,0,0,0,0,0,0,0
VR kan een nuttig hulpmiddel zijn in de overdrachtsfase van stottertherapie.  ,SciSpace,VirtualRealityStotterTherapie.pdf,13,9.081818181818182,11.901818181818179,16.254017363636365,49.542727272727284,15.309090909090907,38.27272727272727,12.486832980505138,3.0,18.536645454545457,1,1,0,0,0,0,0,0,0
"Het tweede prototype, met meer interactieve 360°-scenario's, was realistischer en meeslepender.",SciSpace,VirtualRealityStotterTherapie.pdf,16,12.172307692307694,13.692307692307686,17.654653615384618,30.94769230769233,20.58461538461539,51.46153846153846,15.24744871391589,5.0,17.64206923076923,1,0,0,1,0,0,0,1,0
"Realistische interactie, scenario en technologische implementatie zijn belangrijke factoren voor de  effectiviteit van VR.  4.",SciSpace,VirtualRealityStotterTherapie.pdf,19,17.793333333333333,19.668,24.169647800000007,-5.789999999999996,24.666666666666668,68.33333333333334,17.491376746189438,8.0,20.170500000000004,1,0,0,0,0,1,0,0,0
"volwassenen die stotteren zijn bereid om VR in therapie te gebruiken, maar verder  onderzoek is nodig om de implementatie te verfijnen en de redenen voor niet-gebruik te begrijpen.",SciSpace,VirtualRealityStotterTherapie.pdf,31,15.55857142857143,17.802142857142854,14.641709214285719,33.386428571428596,25.485714285714288,63.714285714285715,20.320508075688775,10.0,19.123514285714286,2,0,0,0,0,1,0,0,0
" (Van der Meulen e.a., 2021)",SciSpace,VirtualRealityStotterTherapie.pdf,9,-3.416666666666666,-4.300000000000001,-3.0924643333333286,130.245,2.4000000000000004,6.0,3.0,0.0,17.092433333333332,0,0,0,0,0,0,0,0,0
